{
  "artifact_sha256": "c8ddb7b3fb95f9c259d56a109abbc96b79e5ea98902ddbed91cc782a080fa623",
  "created_utc": "2026-08-19T16:14:08Z",
  "dataset": "mage (Li et al. 2023, arXiv:2305.13242; Apache-2.0; pinned revision)",
  "detectors": {
    "heuristic": {
      "in_domain": {
        "accuracy": 0.5054242586846465,
        "auprc": 0.5111541662301721,
        "auroc": 0.5080792325703762,
        "brier": 0.24957165449908508,
        "calibration_applied": true,
        "calibration_dataset": "mage (Li et al. 2023, arXiv:2305.13242; split=valid, hygiene-filtered, hash-pinned)",
        "calibration_intercept": 0.008580786725795111,
        "calibration_slope": 0.18327674830386848,
        "conformal": {
          "abstention_rate": 0.8837225579170847,
          "alpha": 0.1,
          "empirical_coverage": 0.9459673844574574,
          "mean_set_size": 1.8837225579170847,
          "singleton_rate": 0.11627744208291534,
          "threshold": 0.5059492231906019
        },
        "detector": "panoptes-heuristic",
        "ece": 0.005802267743482463,
        "n_calibration": 15000,
        "n_test": 42863,
        "n_train": 40000,
        "raw_metrics": {
          "accuracy": 0.460747031239064,
          "auprc": 0.5002510216312741,
          "auroc": 0.4557312606790447,
          "brier": 0.27192042583654114,
          "calibration_intercept": 0.19156127266913023,
          "calibration_slope": -0.40297938770147507,
          "ece": 0.14986441951489485,
          "tpr_at_0.1fpr": 0.0052880601168939605,
          "tpr_at_1fpr": 0.01864736988588923,
          "tpr_at_5fpr": 0.0600241209759718
        },
        "selective_risk": [
          {
            "accuracy": 0.5054242586846465,
            "brier": 0.24957165449908514,
            "coverage": 1.0,
            "empirical_coverage": 1.0,
            "n_kept": 42863,
            "selective_risk": 0.4945757413153536
          },
          {
            "accuracy": 0.49739685658153243,
            "brier": 0.24964508162358767,
            "coverage": 0.95,
            "empirical_coverage": 0.950003499521732,
            "n_kept": 40720,
            "selective_risk": 0.5026031434184676
          },
          {
            "accuracy": 0.482178500142572,
            "brier": 0.24980275351982603,
            "coverage": 0.9,
            "empirical_coverage": 0.900006999043464,
            "n_kept": 38577,
            "selective_risk": 0.517821499857428
          },
          {
            "accuracy": 0.4209559359598729,
            "brier": 0.2504756257929438,
            "coverage": 0.8,
            "empirical_coverage": 0.8000139980869281,
            "n_kept": 34291,
            "selective_risk": 0.5790440640401271
          },
          {
            "accuracy": 0.3416097317113814,
            "brier": 0.25134826249220427,
            "coverage": 0.7,
            "empirical_coverage": 0.7000209971303922,
            "n_kept": 30005,
            "selective_risk": 0.6583902682886186
          },
          {
            "accuracy": 0.12695968645016797,
            "brier": 0.2536735676596237,
            "coverage": 0.5,
            "empirical_coverage": 0.5000116650724401,
            "n_kept": 21432,
            "selective_risk": 0.873040313549832
          }
        ],
        "test_dataset": "mage (Li et al. 2023, arXiv:2305.13242; split=test, hygiene-filtered, hash-pinned)",
        "tpr_at_0.1fpr": 0.0060302439929492534,
        "tpr_at_1fpr": 0.08029501809073197,
        "tpr_at_5fpr": 0.08029501809073197,
        "train_dataset": "mage (Li et al. 2023, arXiv:2305.13242; split=train, hygiene-filtered, hash-pinned)"
      },
      "ood": {
        "accuracy": 0.6508563899868248,
        "auprc": 0.6236014143098466,
        "auroc": 0.6545011109568116,
        "brier": 0.24140010057781464,
        "calibration_applied": true,
        "calibration_intercept": -0.07928107531723357,
        "calibration_slope": 1.386902550541222,
        "conformal": {
          "abstention_rate": 0.6923583662714098,
          "alpha": 0.1,
          "empirical_coverage": 0.9202898550724637,
          "mean_set_size": 1.6923583662714097,
          "singleton_rate": 0.30764163372859027,
          "threshold": 0.5059492231906019
        },
        "ece": 0.12928358771559,
        "n_test": 1518,
        "selective_risk": [
          {
            "accuracy": 0.6508563899868247,
            "brier": 0.24140010057781464,
            "coverage": 1.0,
            "empirical_coverage": 1.0,
            "n_kept": 1518,
            "selective_risk": 0.34914361001317523
          },
          {
            "accuracy": 0.6458766458766458,
            "brier": 0.24108378661653498,
            "coverage": 0.95,
            "empirical_coverage": 0.950592885375494,
            "n_kept": 1443,
            "selective_risk": 0.3541233541233541
          },
          {
            "accuracy": 0.6422823701536211,
            "brier": 0.24072537625622517,
            "coverage": 0.9,
            "empirical_coverage": 0.9005270092226614,
            "n_kept": 1367,
            "selective_risk": 0.35771762984637895
          },
          {
            "accuracy": 0.6263374485596708,
            "brier": 0.23996217766986855,
            "coverage": 0.8,
            "empirical_coverage": 0.8003952569169961,
            "n_kept": 1215,
            "selective_risk": 0.3736625514403292
          },
          {
            "accuracy": 0.6509877704609596,
            "brier": 0.2384434402344524,
            "coverage": 0.7,
            "empirical_coverage": 0.7002635046113307,
            "n_kept": 1063,
            "selective_risk": 0.34901222953904043
          },
          {
            "accuracy": 0.6258234519104084,
            "brier": 0.23481952099341685,
            "coverage": 0.5,
            "empirical_coverage": 0.5,
            "n_kept": 759,
            "selective_risk": 0.37417654808959155
          }
        ],
        "tpr_at_0.1fpr": 0.010526315789473684,
        "tpr_at_1fpr": 0.07236842105263158,
        "tpr_at_5fpr": 0.33289473684210524
      },
      "ood_para": {
        "accuracy": 0.5230769230769231,
        "auprc": 0.7286273121760115,
        "auroc": 0.6038551281067684,
        "brier": 0.24382065789304033,
        "calibration_applied": true,
        "calibration_intercept": 0.7112236602087715,
        "calibration_slope": 0.6241191509940045,
        "conformal": {
          "abstention_rate": 0.7,
          "alpha": 0.1,
          "empirical_coverage": 0.9482905982905983,
          "mean_set_size": 1.7,
          "singleton_rate": 0.3,
          "threshold": 0.5059492231906019
        },
        "ece": 0.1680966721650245,
        "n_test": 2340,
        "selective_risk": [
          {
            "accuracy": 0.523076923076923,
            "brier": 0.24382065789304033,
            "coverage": 1.0,
            "empirical_coverage": 1.0,
            "n_kept": 2340,
            "selective_risk": 0.47692307692307695
          },
          {
            "accuracy": 0.5263157894736843,
            "brier": 0.2434535188800611,
            "coverage": 0.95,
            "empirical_coverage": 0.95,
            "n_kept": 2223,
            "selective_risk": 0.47368421052631576
          },
          {
            "accuracy": 0.5194681861348528,
            "brier": 0.2431867304230902,
            "coverage": 0.9,
            "empirical_coverage": 0.9,
            "n_kept": 2106,
            "selective_risk": 0.4805318138651472
          },
          {
            "accuracy": 0.45940170940170943,
            "brier": 0.24307430046773026,
            "coverage": 0.8,
            "empirical_coverage": 0.8,
            "n_kept": 1872,
            "selective_risk": 0.5405982905982906
          },
          {
            "accuracy": 0.38949938949938945,
            "brier": 0.24284257956262498,
            "coverage": 0.7,
            "empirical_coverage": 0.7,
            "n_kept": 1638,
            "selective_risk": 0.6105006105006106
          },
          {
            "accuracy": 0.5076923076923077,
            "brier": 0.23803322774963723,
            "coverage": 0.5,
            "empirical_coverage": 0.5,
            "n_kept": 1170,
            "selective_risk": 0.49230769230769234
          }
        ],
        "tpr_at_0.1fpr": 0.0,
        "tpr_at_1fpr": 0.02654867256637168,
        "tpr_at_5fpr": 0.2402022756005057
      }
    },
    "logistic": {
      "in_domain": {
        "accuracy": 0.6351398642185568,
        "auprc": 0.6875052212714172,
        "auroc": 0.6755510298334708,
        "brier": 0.22331769259428788,
        "calibration_applied": true,
        "calibration_dataset": "mage (Li et al. 2023, arXiv:2305.13242; split=valid, hygiene-filtered, hash-pinned)",
        "calibration_intercept": 0.001267402395136656,
        "calibration_slope": 0.9422072888390998,
        "conformal": {
          "abstention_rate": 0.8182581713832443,
          "alpha": 0.1,
          "empirical_coverage": 0.9615985815271912,
          "mean_set_size": 1.8182581713832442,
          "singleton_rate": 0.1817418286167557,
          "threshold": 0.6603853482955748
        },
        "detector": "logistic-tier0",
        "ece": 0.010079242259044663,
        "n_calibration": 15000,
        "n_test": 42863,
        "n_train": 40000,
        "raw_metrics": {
          "accuracy": 0.5117233978023004,
          "auprc": 0.7004645291324721,
          "auroc": 0.67153258684284,
          "brier": 0.2641785148880824,
          "calibration_intercept": -0.777960684279335,
          "calibration_slope": 0.9541294207946829,
          "ece": 0.18888316912139538,
          "tpr_at_0.1fpr": 0.037248353279525005,
          "tpr_at_1fpr": 0.08344929956396697,
          "tpr_at_5fpr": 0.22451062250672604
        },
        "selective_risk": [
          {
            "accuracy": 0.6351398642185568,
            "brier": 0.22331769259428788,
            "coverage": 1.0,
            "empirical_coverage": 1.0,